464, But I would hold a pretty wager, but i will hold a pretty wager, -0.00,  0.15, 610,  5.858672,  0.041886,  0.001078, 55.70,  0.999999,  0.05,  0.05, 0, 0, 
465, sir that a House like Tellson and Company was flourishing, serve that a house like tellson and company were flourishing,  0.00,  0.13, 610,  9.719165,  0.051695,  0.000913, 55.71,  0.999999, -0.02, -0.02, 0, 0, 
466, a matter of fifty not to speak of fifteen years ago, a matter of fifty moths i speak of fifteen years ago,  0.00,  0.14, 610,  8.741602,  0.049492,  0.000938, 55.73,  0.999999, -0.01, -0.01, 0, 0, 
467, You might treble that and say a hundred and fifty yet not be far from the truth, you might treble that and say a hundred and fifty yet not be far from the fruit, -0.00,  0.14, 70, 116.274604,  0.542164,  0.008214, 36.90,  0.999898,  0.08,  0.08, 0, 0, 
468, Indeed sir Rounding his mouth and both his eyes as he stepped backward from the table the waiter shifted his napkin from his right arm to his left, in the surrounding his mouth and both his eyes as he stepped backward from the table the waiter shifted his map in from his ride arm to his left,  0.00,  0.13, 610, 22.563129,  0.078917,  0.001064, 55.71,  0.999999,  0.06,  0.06, 0, 0, 
469, dropped into a comfortable attitude and stood surveying the guest while he ate and drank, throughout the into the comfortable at of the andstanceervaingtheguestwideheatendrank, -0.00,  0.14, 610, 13.376502,  0.061108,  0.000993, 55.75,  0.999999, -0.01, -0.01, 0, 0, 
470, as from an observatory or watchtower, as from an eservetoryorloltowr,  0.00,  0.15, 610,  8.027952,  0.049361,  0.000958, 55.74,  0.999999,  0.00,  0.00, 0, 0, 
471, According to the immemorial usage of waiters in all ages, according to the immemorial usage of waters in all ages, -0.00,  0.16, 610, 11.324335,  0.060194,  0.001091, 55.72,  0.999999,  0.10,  0.10, 0, 0, 
472, When Mr Lorry had finished his breakfast he went out for a stroll on the beach, when mister lorry had finished his breakfast he went out for a stroll along the beach,  0.00,  0.14, 610, 13.177135,  0.062192,  0.000971, 55.72,  0.999999, -0.04, -0.04, 0, 0, 
473, The little narrow crooked town of Dover hid itself away from the beach, the little narrow brook i found of dover he god self away from the beach,  0.00,  0.15, 610, 12.201206,  0.061430,  0.001074, 55.75,  0.999999, -0.03, -0.03, 0, 0, 
474, and ran its head into the chalk cliffs like a marine ostrich, and ran its head into the chop cliffs like a marine ostrich,  0.00,  0.14, 610, 10.494327,  0.054661,  0.000997, 55.71,  0.999999,  0.20,  0.20, 0, 0, 
475, The beach was a desert of heaps of sea and stones tumbling wildly about, the beach was a desert of heaps of sea and stone tumbling wildly about,  0.00,  0.14, 50, 149.053687,  0.727062,  0.012939, 33.98,  0.999800,  0.07,  0.07, 0, 0, 
476, and the sea did what it liked and what it liked was destruction, and the sea is what i like and wore light far s distruction, -0.00,  0.13, 610,  9.631315,  0.051158,  0.000911, 55.76,  0.999999,  0.07,  0.07, 0, 0, 
477, It thundered at the town and thundered at the cliffs, if under that the town and under death a qui, -0.00,  0.13, 610,  7.296627,  0.044706,  0.000904, 55.73,  0.999999,  0.01,  0.01, 0, 0, 
478, and brought the coast down madly, and both to coast down madly,  0.00,  0.14, 30, 119.748023,  0.843431,  0.019910, 29.56,  0.999447,  0.08,  0.08, 0, 0, 
479, The air among the houses was of so strong a piscatory flavour that one might have supposed sick fish went up to be dipped in it, the air and the houses was of so strong a pie tory flavor that we might have supposed six fish went up to be the end, -0.00,  0.14, 610, 19.439344,  0.073720,  0.000964, 55.69,  0.999999, -0.01, -0.01, 0, 0, 
480, as sick people went down to be dipped in the sea, as if people went down to be the tin the sea,  0.00,  0.13, 610,  7.121523,  0.044219,  0.000913, 55.74,  0.999999,  0.03,  0.03, 0, 0, 
481, A little fishing was done in the port and a quantity of strolling about by night and looking seaward, a little fishing was done in the port and a want of the strolling about by night and looking seaward, -0.00,  0.15, 610, 15.727255,  0.069371,  0.001137, 55.72,  0.999999, -0.03, -0.03, 0, 0, 
482, particularly at those times when the tide made and was near flood, the king only at those times when the tide made and was near flood, -0.00,  0.15, 610, 11.646097,  0.059059,  0.001015, 55.69,  0.999999, -0.01, -0.01, 0, 0, 
483, Small tradesmen who did no business whatever sometimes unaccountably realised large fortunes, small tradesmen who did no business whatever sometimes on account of lee relied large fortunes,  0.00,  0.15, 610, 17.260434,  0.071535,  0.000964, 55.75,  0.999999, -0.01, -0.01, 0, 0, 
484, and it was remarkable that nobody in the neighbourhood could endure a lamplighter, and it was remarkable that nobody in the neighbourhood for the loralambplider,  0.00,  0.15, 110, 77.239279,  0.368736,  0.005919, 40.82,  0.999959, -0.06, -0.06, 0, 0, 
485, As the day declined into the afternoon, as the vatyplyndintotheaffernoons, -0.00,  0.15, 50, 87.821924,  0.573673,  0.012482, 33.96,  0.999799,  0.02,  0.02, 0, 0, 
486, and the air which had been at intervals clear enough to allow the French coast to be seen, and the air which had been at intervals clear enough to allow the friends close to the sea, -0.00,  0.14, 70, 116.918356,  0.546943,  0.008454, 36.93,  0.999899, -0.05, -0.05, 0, 0, 
487, became again charged with mist and vapour, he came again charged with miss tanfagur,  0.00,  0.14, 610,  7.148084,  0.045164,  0.000905, 55.69,  0.999999,  0.07,  0.07, 0, 0, 
488, Mr Lorry's thoughts seemed to cloud too, mister lorry's thought seemed to plou, -0.00,  0.15, 610,  7.531807,  0.047443,  0.001148, 55.69,  0.999999,  0.01,  0.01, 0, 0, 
489, When it was dark and he sat before the coffee room fire, when he was dark and he sat before the coffee room fire,  0.00,  0.14, 610, 10.113511,  0.054478,  0.001133, 55.66,  0.999999, -0.02, -0.02, 0, 0, 
490, awaiting his dinner as he had awaited his breakfast his mind was busily digging digging digging in the live red coals, awaiting his dinner as he had awaited his breath fast his mind who has businedidindivingtiting in the live red pals, -0.00,  0.15, 610, 18.704064,  0.075480,  0.001066, 55.70,  0.999999, -0.08, -0.08, 0, 0, 
491, A bottle of good claret after dinner does a digger in the red coals no harm, a bottle of gothoredetherdinnerdoesadegarintheredcols no harm, -0.00,  0.15, 610, 12.157840,  0.061010,  0.001030, 55.71,  0.999999,  0.01,  0.01, 0, 0, 
492, otherwise than as it has a tendency to throw him out of work, other wife and as it has a tendency to throw him out of work, -0.00,  0.14, 70, 85.422921,  0.465225,  0.008284, 36.93,  0.999899, -0.08, -0.08, 0, 0, 
493, Mr Lorry had been idle a long time, mister lorry had been able a long time,  0.00,  0.15, 610,  7.886099,  0.049961,  0.001085, 55.66,  0.999999,  0.00,  0.00, 0, 0, 
494, and had just poured out his last glassful of wine with as complete an appearance of satisfaction, and had just poured down his last glassful of wine with as complete in the pearance of satisfaction,  0.00,  0.13, 610, 15.613972,  0.065761,  0.000976, 55.69,  0.999999, -0.03, -0.03, 0, 0, 
495, as is ever to be found in an elderly gentleman of a fresh complexion who has got to the end of a bottle, as is ever to be found in an elderly gentleman of the fresh complexyandthohaspoghtto the end of the bottle, -0.00,  0.15, 610, 16.980351,  0.071778,  0.001145, 55.69,  0.999999, -0.04, -0.04, 0, 0, 
496, when a rattling of wheels came up the narrow street and rumbled into the inn yard, when the rattling of wheels came up the narrow street and rumbled into the enard, -0.00,  0.16, 610, 14.390493,  0.068622,  0.001181, 55.69,  0.999999, -0.03, -0.03, 0, 0, 
497, He set down his glass untouched, he set down his glass and fought, -0.00,  0.12, 610,  5.238429,  0.036082,  0.000817, 55.74,  0.999999,  0.02,  0.02, 0, 0, 
498, This is Mam'selle said he In a very few minutes the waiter came in to announce that Miss Manette had arrived from London, this is man so said he in a very few minutes the waiter came in to announce that miss manechatherived from london,  0.00,  0.15, 610, 19.603589,  0.077955,  0.001024, 55.68,  0.999999, -0.00, -0.00, 0, 0, 
499, and would be happy to see the gentleman from Tellson's, and would be happy to see the gentleman from felons,  0.00,  0.14, 610,  8.975213,  0.050053,  0.000957, 55.70,  0.999999, -0.06, -0.06, 0, 0, 
500, So soon Miss Manette had taken some refreshment on the road and required none then, so soon miss monica taken some of reshment on the road and required none de, -0.00,  0.15, 610, 14.867190,  0.067646,  0.001106, 55.72,  0.999999,  0.01,  0.01, 0, 0, 
501, and was extremely anxious to see the gentleman from Tellson's immediately, and was extremely anxious to see the gentleman from felsinstemediately, -0.00,  0.14, 610, 13.987741,  0.064591,  0.001014, 55.68,  0.999999, -0.06, -0.06, 0, 0, 
502, if it suited his pleasure and convenience, if it did his pleasure and convenience, -0.00,  0.14, 50, 87.744826,  0.553202,  0.011541, 33.96,  0.999799,  0.04,  0.04, 0, 0, 
503, The gentleman from Tellson's had nothing left for it but to empty his glass with an air of stolid desperation, the gentleman from tellson's had nothing left for it but to empty his glass with a narrow stone desperation, -0.00,  0.14, 610, 17.501837,  0.071687,  0.000967, 55.71,  0.999999, -0.00, -0.00, 0, 0, 
504, settle his odd little flaxen wig at the ears and follow the waiter to Miss Manette's apartment, settled his alibi lakes and wave at the airs and follow the waiter to miss manette's apartment, -0.00,  0.15, 610, 16.306604,  0.070446,  0.001072, 55.67,  0.999999, -0.02, -0.02, 0, 0, 
505, It was a large dark room furnished in a funereal manner with black horsehair and loaded with heavy dark tables, it was a large dark room furnished in a few mere manner with black for her and loaded with heavy dark tables, -0.00,  0.16, 610, 21.024999,  0.082272,  0.001172, 55.71,  0.999999, -0.01, -0.01, 0, 0, 
506, These had been oiled and oiled until the two tall candles on the table in the middle of the room were gloomily reflected on every leaf, these had the mail in the yaldeniletotallcandleson the table in the middle of the room were gloomily with elected on every wee,  0.00,  0.16, 610, 22.541030,  0.085845,  0.001163, 55.70,  0.999999, -0.00, -0.00, 0, 0, 
507, as if they were buried in deep graves of black mahogany, as if they were very in deep graves of black mahogany,  0.00,  0.15, 310, 19.535982,  0.106909,  0.001942, 49.85,  0.999995,  0.03,  0.03, 0, 0, 
508, and no light to speak of could be expected from them until they were dug out, and no light to speak of to be expected from them until they were dug out, -0.00,  0.13, 610, 11.965572,  0.057449,  0.000941, 55.70,  0.999999, -0.03, -0.03, 0, 0, 
509, The obscurity was so difficult to penetrate that Mr Lorry picking his way over the well worn Turkey carpet, the other he was so difficult to penetrate that mister lorry going his way over the well worn thirty carpet,  0.00,  0.15, 610, 19.880713,  0.077877,  0.001119, 55.71,  0.999999,  0.02,  0.02, 0, 0, 
510, supposed Miss Manette to be for the moment in some adjacent room, supposed miss manette to be for the moment in some of jason room, -0.00,  0.14, 590, 11.043954,  0.058238,  0.001067, 55.42,  0.999999,  0.10,  0.10, 0, 0, 
511, until having got past the two tall candles he saw standing to receive him by the table, and to having the past the two tall candles he saw standing through a seive in by the table,  0.00,  0.14, 610, 14.773917,  0.064499,  0.000990, 55.70,  0.999999, -0.01, -0.01, 0, 0, 
512, between them and the fire a young lady of not more than seventeen in a riding cloak, i mean them and the fire a young lady of not more than seventeen in a riding cloak, -0.00,  0.16, 610, 14.668341,  0.068513,  0.001164, 55.75,  0.999999, -0.01, -0.01, 0, 0, 
513, and still holding her straw travelling hat by its ribbon in her hand, and still holding her straw travelling half by its ribbon in her hand, -0.00,  0.14, 170, 42.065610,  0.209224,  0.003735, 44.60,  0.999983, -0.14, -0.14, 0, 0, 
514, As his eyes rested on a short slight pretty figure a quantity of golden hair, as his eyes rested on the short slight pretty figure one o the a foldin hair, -0.00,  0.14, 610, 13.104823,  0.061322,  0.001001, 55.69,  0.999999,  0.01,  0.01, 0, 0, 
515, a pair of blue eyes that met his own with an inquiring look and a forehead with a singular capacity, a pair of blue eyes that met his own with an implyeryglovinteforehead with a singular capacity, -0.00,  0.15, 610, 16.290357,  0.069882,  0.001040, 55.68,  0.999999, -0.06, -0.06, 0, 0, 
516, remembering how young and smooth it was, remembering how young and smooth i guess, -0.00,  0.15, 610,  7.715939,  0.049328,  0.001015, 55.75,  0.999999, -0.04, -0.04, 0, 0, 
517, of rifting and knitting itself into an expression that was not quite one of perplexity or wonder or alarm or merely of a bright fixed attention, of rifting and knitting itself into an expression that was not plight when the perplexity or wonder or alarm more merely of a bright fixed attention, -0.00,  0.15, 610, 24.300706,  0.085405,  0.001055, 55.75,  0.999999, -0.04, -0.04, 0, 0, 
518, though it included all the four expressions as his eyes rested on these things, the levinpluetevaledtheforixpressionsashiseyeswrestedon these dans, -0.00,  0.14, 610, 12.556021,  0.060417,  0.001055, 55.69,  0.999999,  0.03,  0.03, 0, 0, 
519, a sudden vivid likeness passed before him of a child whom he had held in his arms on the passage across, a sudden vivid likeness passed before him of the child whom he had held in his arms on the passage across, -0.00,  0.14, 590, 16.635646,  0.069293,  0.001144, 55.44,  0.999999, -0.07, -0.07, 0, 0, 
520, that very Channel one cold time when the hail drifted heavily and the sea ran high, the very channel in full time when the hail drifted heavily and the sea ran high, -0.00,  0.15, 610, 13.887285,  0.064741,  0.001077, 55.71,  0.999999, -0.01, -0.01, 0, 0, 
521, The likeness passed away like a breath along the surface of the gaunt pier glass behind her, the likeness passed away like a breath along the surface of the bump fer glass behind her,  0.00,  0.14, 610, 13.948230,  0.063232,  0.001031, 55.72,  0.999999,  0.02,  0.02, 0, 0, 
522, on the frame of which a hospital procession of negro cupids, on the frame of which the hospital procession of negro cupids, -0.00,  0.14, 430, 14.974371,  0.077786,  0.001429, 52.65,  0.999997, -0.02, -0.02, 0, 0, 
523, several headless and all cripples were offering black baskets of Dead Sea fruit to black divinities of the feminine gender, several headless and all peoples were offering black baskets of dead sea fruit to black divinities of the feminine gender,  0.00,  0.14, 610, 19.673336,  0.076458,  0.001125, 55.72,  0.999999,  0.02,  0.02, 0, 0, 
524, and he made his formal bow to Miss Manette Pray take a seat, and he made his formal bow to miss manetpraytapeaseat, -0.00,  0.14, 610, 10.256816,  0.055140,  0.001165, 55.69,  0.999999,  0.02,  0.02, 0, 0, 
525, sir In a very clear and pleasant young voice, the ring the very clear and pleasant young voice,  0.00,  0.15, 610,  8.165040,  0.049625,  0.000999, 55.73,  0.999999,  0.44,  0.44, 0, 0, 
526, a little foreign in its accent but a very little indeed, a little foreign in its accent but in a very little indeed, -0.00,  0.15, 610,  9.254627,  0.053408,  0.001050, 55.76,  0.999999, -0.17, -0.17, 0, 0, 
527, I kiss your hand miss said Mr Lorry with the manners of an earlier date, i guess you were hand miss said mister lorry with the manners of an earlier date, -0.00,  0.15, 530, 15.021546,  0.073661,  0.001213, 54.51,  0.999998,  0.01,  0.01, 0, 0, 
528, as he made his formal bow again and took his seat, as he made his formal bow again into his seat,  0.00,  0.14, 610,  9.094595,  0.051920,  0.001129, 55.66,  0.999999, -0.03, -0.03, 0, 0, 
529, I received a letter from the Bank sir, i received the letter from the bank sir,  0.00,  0.14, 610,  6.316699,  0.042494,  0.000973, 55.73,  0.999999,  0.05,  0.05, 0, 0, 
530, yesterday informing me that some intelligence or discovery, yes ter day informing me that some intelligence or this covery,  0.00,  0.15, 110, 58.884167,  0.315277,  0.005761, 40.87,  0.999959, -0.04, -0.04, 0, 0, 
531, The word is not material miss either word will do respecting the small property of my poor father, the word is not material miss either word will do respecting the small property of my gorrifather,  0.00,  0.15, 610, 17.592256,  0.073725,  0.001147, 55.73,  0.999999,  0.00,  0.00, 0, 0, 
532, whom I never saw so long dead, he i never saw some long dead,  0.00,  0.16, 610,  6.758629,  0.046986,  0.001097, 55.72,  0.999999,  0.06,  0.06, 0, 0, 
533, Mr Lorry moved in his chair and cast a troubled look towards the hospital procession of negro cupids, mister lorry moved in his terror and cast a troubled look towards the hospital procession of negro hue that,  0.00,  0.14, 610, 19.285989,  0.075574,  0.001056, 55.69,  0.999999, -0.01, -0.01, 0, 0, 
534, As if they had any help for anybody in their absurd baskets, as if they had any help for any body in their absurd baskets, -0.00,  0.14, 610, 10.508558,  0.055017,  0.001110, 55.71,  0.999999, -0.07, -0.07, 0, 0, 
535, rendered it necessary that I should go to Paris there to communicate with a gentleman of the Bank, render it necessary that i should go to paris there to communicate with a gentleman of the bank,  0.00,  0.14, 610, 15.234746,  0.066483,  0.000974, 55.72,  0.999999,  0.09,  0.09, 0, 0, 
536, so good as to be despatched to Paris for the purpose Myself, so the astibydispassedtoharryfor the first as my fell, -0.00,  0.12, 10, 541.082527,  2.808442,  0.051923, 19.95,  0.994981,  0.02,  0.02, 0, 0, 
537, As I was prepared to hear sir She curtseyed to him, as i was prepared to hear sir the curtsy to him, -0.00,  0.13, 610,  8.647144,  0.048376,  0.000972, 55.72,  0.999999,  0.05,  0.05, 0, 0, 
538, young ladies made curtseys in those days, numb ladies may curses in those days, -0.00,  0.15, 50, 97.019131,  0.604678,  0.011940, 33.93,  0.999798, -0.00, -0.00, 0, 0, 
539, with a pretty desire to convey to him that she felt how much older and wiser he was than she, with a pretty desire to convey to him that she felt how much older and wiser he was then she,  0.00,  0.14, 610, 15.428494,  0.067020,  0.000994, 55.69,  0.999999, -0.01, -0.01, 0, 0, 
540, He made her another bow I replied to the Bank, he made her another val i replied to the bank, -0.00,  0.14, 390, 12.908117,  0.077261,  0.001606, 51.79,  0.999997,  0.01,  0.01, 0, 0, 
541, sir that as it was considered necessary, ser bad as it was considered necessary, -0.00,  0.13, 70, 58.512223,  0.364369,  0.007915, 36.94,  0.999899, -0.11, -0.11, 0, 0, 
542, by those who know and who are so kind as to advise me, by those who know and are so kind as to advise me, -0.00,  0.15, 610,  9.626502,  0.054019,  0.001264, 55.67,  0.999999, -0.04, -0.04, 0, 0, 
543, that I should go to France and that as I am an orphan and have no friend who could go with me, that i so thought to france and that as i am an orphan and have no friend who could go with me, -0.00,  0.14, 610, 15.725455,  0.068354,  0.001053, 55.72,  0.999999, -0.01, -0.01, 0, 0, 
544, I should esteem it highly if I might be permitted to place myself during the journey under that worthy gentleman's protection, i saw the steam it highly if i might be permitted to place myself during the journey under that worthy gentleman's protection,  0.00,  0.14, 610, 20.385779,  0.077525,  0.001076, 55.73,  0.999999, -0.02, -0.02, 0, 0, 
545, The gentleman had left London but I think a messenger was sent after him to beg the favour of his waiting for me here, the gentleman had left london but i think the messenger was sent after him to beg the favour of his waiting for me here,  0.00,  0.15, 610, 18.568154,  0.074910,  0.001218, 55.72,  0.999999, -0.02, -0.02, 0, 0, 
546, I was happy said Mr Lorry to be entrusted with the charge, i was happy said mister lorry to be intrusted with the charge, -0.00,  0.14, 610, 11.493878,  0.057736,  0.000956, 55.70,  0.999999, -0.01, -0.01, 0, 0, 
547, I shall be more happy to execute it Sir, i shall be more happy less of you that sir, -0.00,  0.14, 30, 162.853825,  0.983587,  0.019224, 29.57,  0.999448, -0.00, -0.00, 0, 0, 
548, I thank you indeed, i fankulindeve,  0.00,  0.15, 30, 79.831875,  0.702079,  0.020701, 29.56,  0.999447,  0.02,  0.02, 0, 0, 
549, I thank you very gratefully, i think i very gratefully,  0.00,  0.15, 30, 120.658955,  0.875092,  0.021638, 29.60,  0.999453, -0.08, -0.08, 0, 0, 
550, It was told me by the Bank that the gentleman would explain to me the details of the business, it was told me by the bank that the gentleman with explain to me that the tails of the business,  0.00,  0.14, 610, 13.940627,  0.062677,  0.000920, 55.73,  0.999999, -0.02, -0.02, 0, 0, 
551, and that I must prepare myself to find them of a surprising nature, and that i must prepare myself be find them it is epic in natur, -0.00,  0.14, 10, 721.861628,  3.543865,  0.058067, 19.99,  0.995035, -0.02, -0.02, 0, 0, 
552, I have done my best to prepare myself and I naturally have a strong and eager interest to know what they are, i have done my best to prepare myself and i naturally have a strong and eager interest in to what they are, -0.00,  0.15, 610, 19.301180,  0.076357,  0.001132, 55.73,  0.999999, -0.00, -0.00, 0, 0, 
553, Naturally said Mr Lorry, naturally at mister lorry,  0.00,  0.16, 50, 77.650142,  0.553631,  0.013143, 33.95,  0.999799,  0.05,  0.05, 0, 0, 
554, Yes I After a pause he added, yes i have for the past he added, -0.00,  0.13, 610,  5.587649,  0.039199,  0.000935, 55.69,  0.999999, -0.01, -0.01, 0, 0, 
555, again settling the crisp flaxen wig at the ears, again settling the crisp leaves and way at the ears,  0.00,  0.14, 610,  8.783482,  0.050180,  0.000919, 55.72,  0.999999,  0.14,  0.14, 0, 0, 
556, It is very difficult to begin, it is very difficult to be ginning,  0.00,  0.13, 290, 10.869901,  0.078787,  0.001876, 49.25,  0.999994,  0.00,  0.00, 0, 0, 
557, He did not begin but in his indecision met her glance, he did not begin but in his indecision met her lands,  0.00,  0.13, 610,  9.371323,  0.050877,  0.000899, 55.70,  0.999999, -0.01, -0.01, 0, 0, 
558, The young forehead lifted itself into that singular expression, the lum forehead lifted itself into that singular expression, -0.00,  0.14, 50, 128.970523,  0.675300,  0.012057, 33.98,  0.999800,  0.04,  0.04, 0, 0, 
559, but it was pretty and characteristic besides being singular and she raised her hand, but it was pretty and terractoristic besides being singular and she raised her hand,  0.00,  0.14, 110, 75.649747,  0.342087,  0.005133, 40.90,  0.999959,  0.01,  0.01, 0, 0, 
560, as if with an involuntary action she caught at or stayed some passing shadow, as if with an involuntary action she caught at or state some passing shadow,  0.00,  0.14, 610, 12.870287,  0.061036,  0.001086, 55.75,  0.999999,  0.04,  0.04, 0, 0, 
561, Are you quite a stranger to me sir Am I not, are you fly to stranger to me sir a m y not,  0.00,  0.15, 610,  8.823790,  0.052646,  0.001130, 55.65,  0.999999, -0.00, -0.00, 0, 0, 
562, Mr Lorry opened his hands and extended them outwards with an argumentative smile, mister lorry opened his hands and extended them outwards with an argument ad it smile,  0.00,  0.14, 610, 14.622402,  0.065508,  0.001116, 55.71,  0.999999,  0.02,  0.02, 0, 0, 
563, Between the eyebrows and just over the little feminine nose, i mean the eyebrows and just over the little feminine nose,  0.00,  0.15, 270, 23.446717,  0.129699,  0.002643, 48.60,  0.999993,  0.06,  0.06, 0, 0, 
564, the line of which was as delicate and fine as it was possible to be, the lying of which was as delicate and fine as it was possible to be, -0.00,  0.14, 290, 24.323002,  0.121784,  0.002130, 49.24,  0.999994,  0.10,  0.10, 0, 0, 
565, the expression deepened itself as she took her seat thoughtfully in the chair by which she had hitherto remained standing, the express in deepened itself as she took her seat a fly in the car by which she had hitherto remained standing,  0.00,  0.14, 610, 17.213516,  0.070877,  0.001063, 55.70,  0.999999, -0.01, -0.01, 0, 0, 
566, He watched her as she mused and the moment she raised her eyes again went on, he was her as she mused and the moment she raised her life again went on,  0.00,  0.14, 610, 13.148561,  0.062405,  0.001008, 55.70,  0.999999, -0.06, -0.06, 0, 0, 
567, In your adopted country, in the or tout the country, -0.00,  0.15, 610,  4.885704,  0.038604,  0.001336, 55.73,  0.999999, -0.16, -0.16, 0, 0, 
568, I presume I cannot do better than address you as a young English lady, i presume i can not do better than address you as a young english lady, -0.00,  0.15, 70, 101.873063,  0.520481,  0.009294, 36.90,  0.999898, -0.01, -0.01, 0, 0, 
569, Miss Manette If you please, miss manevetheplease,  0.00,  0.14, 610,  4.895195,  0.038044,  0.001184, 55.68,  0.999999,  0.01,  0.01, 0, 0, 
570, sir Miss Manette I am a man of business, sir miss manet i am the man of business, -0.00,  0.14, 610,  6.979325,  0.045474,  0.001014, 55.70,  0.999999,  0.06,  0.06, 0, 0, 
571, I have a business charge to acquit myself of, i have a business charge to a click myself, -0.00,  0.12, 610,  7.186297,  0.042533,  0.000864, 55.68,  0.999999,  0.09,  0.09, 0, 0, 
