799, and certainly not in the fabulous mill which ground old people young shivered at every corner passed in, answered lil in the fabulous mill which ground little people young shivered at every corner passed in, -0.00,  0.15, 610, 17.389836,  0.073096,  0.001075, 55.70,  0.999999, -0.02, -0.02, 0, 0, 
800, and out at every doorway looked from every window fluttered in every vestige of a garment that the wind shook, and now that every door may looked from every window flutter in every vestige of the garment that the wind shook, -0.00,  0.15, 610, 16.892938,  0.072150,  0.001158, 55.69,  0.999999,  0.04,  0.04, 0, 0, 
801, The mill which had worked them down was the mill that grinds young people old, the mill we had worked them down was the mill that grinds young people old,  0.00,  0.15, 610, 12.709723,  0.062830,  0.001247, 55.70,  0.999999, -0.05, -0.05, 0, 0, 
802, the children had ancient faces and grave voices and upon them and upon the grown faces, the children had ancient faces and grave voices and upon them and upon the grow faces, -0.00,  0.14, 250, 34.860167,  0.155681,  0.002651, 47.95,  0.999992, -0.07, -0.07, 0, 0, 
803, and ploughed into every furrow of age and coming up afresh was the sigh, and floundintolivryfurtiloagent coming up as reshwilsthesihe,  0.00,  0.14, 610, 11.349795,  0.057058,  0.000900, 55.71,  0.999999,  0.02,  0.02, 0, 0, 
804, It was prevalent everywhere Hunger was pushed out of the tall houses in the wretched clothing that hung upon poles and lines, it was prevalent everywhere hundred was pushed out of the tall houses in the wretched clothing that on the pon poles and lines, -0.00,  0.14, 610, 19.989172,  0.076718,  0.001186, 55.69,  0.999999, -0.05, -0.05, 0, 0, 
805, Hunger was patched into them with straw and rag and wood and paper, anger was patched into them with strong ragon with and paper,  0.00,  0.14, 610, 10.909352,  0.055981,  0.000948, 55.69,  0.999999, -0.04, -0.04, 0, 0, 
806, Hunger was repeated in every fragment of the small modicum of firewood that the man sawed off, anger was weeded in every fragment of the small modicum er fire with at the men sought off,  0.00,  0.15, 610, 16.302447,  0.070022,  0.001190, 55.72,  0.999999, -0.00, -0.00, 0, 0, 
807, Hunger stared down from the smokeless chimneys and started up from the filthy street that had no offal among its refuse of anything to eat, hunderstarefounfromthesmoteless tomes and started up from the filly street that had no lawful emonets refuse of any thing to eat,  0.00,  0.14, 610, 22.982965,  0.082796,  0.001110, 55.69,  0.999999, -0.08, -0.08, 0, 0, 
808, Hunger was the inscription on the baker's shelves written in every small loaf of his scanty stock of bad bread, anger was the inscription on the bakers sell ran in every small loaf of his standystopofbackgread, -0.00,  0.14, 610, 18.395131,  0.073719,  0.000974, 55.73,  0.999999, -0.01, -0.01, 0, 0, 
809, at the sausage shop in every dead dog preparation that was offered for sale, at the sausage shop in every day of preparation that was offered for sale,  0.00,  0.14, 610, 12.388937,  0.059026,  0.000984, 55.72,  0.999999, -0.03, -0.03, 0, 0, 
810, Hunger rattled its dry bones among the roasting chestnuts in the turned cylinder, and he rattled its dry bones among the roasting chestnuts in the fire cylinder, -0.00,  0.15, 610, 13.985845,  0.065666,  0.001097, 55.67,  0.999999,  0.05,  0.05, 0, 0, 
811, Hunger was shred into atomics in every farthing porringer of husky chips of potato fried with some reluctant drops of oil, and there was a thread into the tares in every farthing porringer of husky chips of potato fried with some reluctant drops of oil,  0.00,  0.14, 610, 21.857046,  0.080226,  0.001045, 55.73,  0.999999, -0.05, -0.05, 0, 0, 
812, Its abiding place was in all things fitted to it, it abiding place was in all things fitted to it, -0.00,  0.13, 30, 148.144903,  0.895400,  0.017536, 29.55,  0.999446, -0.01, -0.01, 0, 0, 
813, A narrow winding street full of offence and stench with other narrow winding streets diverging all peopled by rags and nightcaps, a narrow winding street full of a fence and stench with other narrow winding streets diverging all peopled by reds and night gates, -0.00,  0.15, 610, 22.763693,  0.083447,  0.001085, 55.67,  0.999999, -0.05, -0.05, 0, 0, 
814, and all smelling of rags and nightcaps and all visible things with a brooding look upon them that looked ill, and all smelling of red and night gates and all visible things with a brutinglookuponthemthatlooked ill,  0.00,  0.15, 610, 16.880257,  0.070945,  0.001030, 55.71,  0.999999, -0.00, -0.00, 0, 0, 
815, In the hunted air of the people there was yet some wild beast thought of the possibility of turning at bay, in the hunt are of the people there was yet some wild beasts thought of the possibility of turning at bay,  0.00,  0.14, 610, 16.417824,  0.069474,  0.001011, 55.70,  0.999999, -0.04, -0.04, 0, 0, 
816, Depressed and slinking though they were eyes of fire were not wanting among them, depressed then slinking though they were is a fire were not wanting among them,  0.00,  0.15, 610, 12.674271,  0.062744,  0.001007, 55.69,  0.999999, -0.05, -0.05, 0, 0, 
817, nor compressed lips white with what they suppressed nor foreheads knitted into the likeness of the gallows rope they mused about enduring or inflicting, nor confessedly life with what they suppressed nor foreheads emitted into the likeness of the gallows road they used the boutinveringorinfuliting,  0.00,  0.15, 610, 23.899940,  0.085243,  0.001073, 55.70,  0.999999,  0.02,  0.02, 0, 0, 
818, The trade signs and they were almost as many as the shops were all grim illustrations of Want, the trade signs and they were almost as many as the shops were all gremelessstracons of want,  0.00,  0.15, 610, 16.559587,  0.071976,  0.001195, 55.67,  0.999999, -0.01, -0.01, 0, 0, 
819, The butcher and the porkman painted up only the leanest scrags of meat, the butter and the poor man taineeotthenlegalinestscrats of meat, -0.00,  0.15, 610, 11.760468,  0.059689,  0.001044, 55.69,  0.999999, -0.00, -0.00, 0, 0, 
820, the baker the coarsest of meagre loaves, the baker the courses of meager loa, -0.00,  0.14, 610,  6.497780,  0.042374,  0.000947, 55.73,  0.999999,  0.12,  0.12, 0, 0, 
821, The people rudely pictured as drinking in the wine shops croaked over their scanty measures of thin wine and beer, the people who we could servesterinetingin the wine shops croaked over their standy measures of the wine and per, -0.00,  0.15, 610, 18.736104,  0.075259,  0.000998, 55.67,  0.999999, -0.01, -0.01, 0, 0, 
822, and were gloweringly confidential together, and word gloweringly confidential together,  0.00,  0.15, 250, 21.167415,  0.127131,  0.002639, 47.94,  0.999992, -0.08, -0.08, 0, 0, 
823, Nothing was represented in a flourishing condition save tools and weapons, nothing was represented in a flourish in condition safe to o and weapons, -0.00,  0.14, 610, 12.853798,  0.061741,  0.001082, 55.73,  0.999999, -0.01, -0.01, 0, 0, 
824, but the cutler's knives and axes were sharp and bright, but the cutler's knives and axes were sharp in bright,  0.00,  0.13, 270, 20.426442,  0.111546,  0.002282, 48.67,  0.999993, -0.05, -0.05, 0, 0, 
825, the smith's hammers were heavy and the gunmaker's stock was murderous, the smith's hammers were heavy and the ten tigers thought was murderess, -0.00,  0.14, 610, 11.394253,  0.057742,  0.001084, 55.68,  0.999999, -0.02, -0.02, 0, 0, 
826, The crippling stones of the pavement with their many little reservoirs of mud and water, the creeping stones of the pavement with their many wotareasersars of mother and wate,  0.00,  0.15, 610, 13.700505,  0.064548,  0.001056, 55.76,  0.999999,  0.01,  0.01, 0, 0, 
827, had no footways but broke off abruptly at the doors, had no foot lace but throw off a gravely at the doors, -0.00,  0.14, 610,  9.688494,  0.052926,  0.001052, 55.73,  0.999999,  0.05,  0.05, 0, 0, 
828, The kennel to make amends ran down the middle of the street when it ran at all, the kennel to make amends ran down the middle of the street when he ran at all, -0.00,  0.14, 610, 12.460028,  0.060911,  0.001030, 55.72,  0.999999,  0.05,  0.05, 0, 0, 
829, which was only after heavy rains and then it ran by many eccentric fits into the houses, with was only after heavy rains and then it ran by many eccentric fits into the houses, -0.00,  0.14, 510, 19.365782,  0.082462,  0.001267, 54.15,  0.999998, -0.02, -0.02, 0, 0, 
830, Across the streets at wide intervals one clumsy lamp was slung by a rope and pulley at night, across the streets at wide intervals when flunsylampwesslumbyaroadandflyatnight, -0.00,  0.14, 610, 16.150386,  0.069348,  0.001119, 55.71,  0.999999, -0.05, -0.05, 0, 0, 
831, when the lamplighter had let these down and lighted and hoisted them again, when the lamplighter had let these down and lighted and voiced them again,  0.00,  0.15, 610, 11.900668,  0.059921,  0.000991, 55.69,  0.999999,  0.00,  0.00, 0, 0, 
832, a feeble grove of dim wicks swung in a sickly manner overhead as if they were at sea, a feeble grove of them with wine in a silly manner overhead as if they were at sea,  0.00,  0.15, 610, 14.370755,  0.066174,  0.001113, 55.73,  0.999999, -0.02, -0.02, 0, 0, 
833, Indeed they were at sea and the ship and crew were in peril of tempest, in the they were at sea and the shape and power in peril of tempest,  0.00,  0.15, 610, 11.133014,  0.057566,  0.001003, 55.72,  0.999999,  0.04,  0.04, 0, 0, 
834, For the time was to come when the gaunt scarecrows of that region should have watched the lamplighter, for the time was to come when the bump their prows of the greed and so the lots the lamplighter,  0.00,  0.14, 610, 15.071328,  0.064881,  0.000960, 55.74,  0.999999, -0.02, -0.02, 0, 0, 
835, in their idleness and hunger so long as to conceive the idea of improving on his method, in their idleness and hunger so long as to conceive the idea of improving on his methods, -0.00,  0.15, 130, 71.135788,  0.318747,  0.005602, 42.26,  0.999970, -0.03, -0.03, 0, 0, 
836, and hauling up men by those ropes and pulleys to flare upon the darkness of their condition, and falling up men by those roads and pleased to flare upon the darkness of their condition, -0.00,  0.14, 610, 15.050758,  0.066223,  0.001091, 55.70,  0.999999, -0.00, -0.00, 0, 0, 
837, But the time was not come yet and every wind that blew over France shook the rags of the scarecrows in vain, but the time was not come yet and every wind that blew over france shook the rats of the sparrows in vain, -0.00,  0.14, 610, 17.297387,  0.070311,  0.000968, 55.71,  0.999999, -0.02, -0.02, 0, 0, 
838, for the birds fine of song and feather took no warning, for the birds fine of son and father oh no warning, -0.00,  0.15, 610, 10.014151,  0.055297,  0.001110, 55.71,  0.999999,  0.03,  0.03, 0, 0, 
839, The wine shop was a corner shop better than most others in its appearance and degree, the wine shop was a corner soft better than most others in its appearance and degree,  0.00,  0.15, 610, 13.880590,  0.065400,  0.001242, 55.69,  0.999999,  0.02,  0.02, 0, 0, 
840, and the master of the wine shop had stood outside it in a yellow waistcoat and green breeches, and the master of the wine shop had stood outside it in a yellow waist o and three in breeches,  0.00,  0.14, 610, 15.898768,  0.068516,  0.000960, 55.69,  0.999999, -0.05, -0.05, 0, 0, 
841, looking on at the struggle for the lost wine, looking on it a struggle for the lost wine, -0.00,  0.14, 70, 64.883282,  0.407568,  0.009571, 36.91,  0.999898,  0.09,  0.09, 0, 0, 
842, It's not my affair said he with a final shrug of the shoulders, it is not my affair said he was a final shrug of the shoulders, -0.00,  0.14, 610, 10.188435,  0.053962,  0.000949, 55.69,  0.999999, -0.03, -0.03, 0, 0, 
843, The people from the market did it Let them bring another, the people from the market they did let them bring another, -0.00,  0.15, 610,  9.131842,  0.052650,  0.001070, 55.73,  0.999999,  0.04,  0.04, 0, 0, 
844, There his eyes happening to catch the tall joker writing up his joke he called to him across the way, there his eyes happening to catch the tall joker writing up his joy called to him across the way,  0.00,  0.14, 610, 15.704192,  0.067305,  0.001026, 55.69,  0.999999,  0.09,  0.09, 0, 0, 
845, Say then my Gaspard what do you do there, save then my gaspard what do you do there, -0.00,  0.15, 610,  7.772511,  0.048491,  0.001001, 55.70,  0.999999,  0.04,  0.04, 0, 0, 
846, The fellow pointed to his joke with immense significance as is often the way with his tribe, the fellow pointed to his child with immense significance as is often the way with his tribe,  0.00,  0.14, 610, 13.845067,  0.062301,  0.001177, 55.71,  0.999999,  0.02,  0.02, 0, 0, 
847, It missed its mark and completely failed, it miss its mark and completely failed, -0.00,  0.14, 210, 19.166116,  0.124321,  0.002624, 46.45,  0.999989, -0.04, -0.04, 0, 0, 
848, as is often the way with his tribe too, as is often the way with his tri to,  0.00,  0.14, 610,  6.817218,  0.044270,  0.001076, 55.69,  0.999999,  0.08,  0.08, 0, 0, 
849, Are you a subject for the mad hospital said the wine shop keeper crossing the road, are you assented for the mad hospital said the wine shop keeper crossing the road, -0.00,  0.14, 570, 14.299440,  0.066029,  0.001080, 55.09,  0.999998,  0.00,  0.00, 0, 0, 
850, and obliterating the jest with a handful of mud picked up for the purpose and smeared over it, and obliterating the jest with the handful of mudlytuht for the purpose and mere over, -0.00,  0.14, 610, 13.919799,  0.062681,  0.001003, 55.72,  0.999999,  0.01,  0.01, 0, 0, 
851, Why do you write in the public streets, why do you ride in the public streets,  0.00,  0.15, 610,  7.396355,  0.046870,  0.000984, 55.75,  0.999999,  0.28,  0.28, 0, 0, 
852, Is there tell me thou is there no other place to write such words in, is there tell me don is there no other place to write such words in,  0.00,  0.15, 610, 12.390262,  0.061410,  0.001019, 55.70,  0.999999,  0.03,  0.03, 0, 0, 
853, In his expostulation he dropped his cleaner hand perhaps accidentally perhaps not upon the joker's heart, in his expostulation he draw his cleaner hand for had sexhidentally perhaps not a on the joker's heart, -0.00,  0.13, 50, 216.351841,  0.853031,  0.011654, 33.97,  0.999799,  0.01,  0.01, 0, 0, 
854, The joker rapped it with his own took a nimble spring upward, the joker rapped it with his own foot and bible spring upward,  0.00,  0.14, 610,  9.361207,  0.051506,  0.000923, 55.72,  0.999999, -0.02, -0.02, 0, 0, 
855, and came down in a fantastic dancing attitude with one of his stained shoes jerked off his foot into his hand and held out, and came down in a fantastic dancing out of it with one of his tan shoes jerked off his foot into his hand and held out,  0.00,  0.13, 610, 17.947819,  0.070268,  0.001063, 55.70,  0.999999, -0.04, -0.04, 0, 0, 
856, A joker of an extremely not to say wolfishly practical character, until girl in extremely not to say o f isly practical carried,  0.00,  0.14, 610, 12.495902,  0.060822,  0.001030, 55.71,  0.999999,  0.01,  0.01, 0, 0, 
857, he looked under those circumstances, he was under those circumstances,  0.00,  0.13, 610,  6.309241,  0.041153,  0.000957, 55.73,  0.999999,  0.08,  0.08, 0, 0, 
858, he wiped his soiled hand upon the joker's dress such as it was quite deliberately, he wiped his loyal hand upon the joker's dress up as it was twice deliberately, -0.00,  0.14, 610, 13.650507,  0.062145,  0.001042, 55.70,  0.999999,  0.04,  0.04, 0, 0, 
859, as having dirtied the hand on his account and then recrossed the road and entered the wine shop, as having very the hand on his account and then recrossed the road and entered the wine shop, -0.00,  0.14, 610, 14.015600,  0.063588,  0.001029, 55.70,  0.999999,  0.07,  0.07, 0, 0, 
860, This wine shop keeper was a bull necked martial looking man of thirty, this wine shop keeper was a bull neck marsa looking man of thirty, -0.00,  0.15, 610, 12.187951,  0.061753,  0.001021, 55.71,  0.999999,  0.02,  0.02, 0, 0, 
861, and he should have been of a hot temperament for although it was a bitter day, and he so have been of the heart temperament for although it was a bitter day, -0.00,  0.14, 610, 11.226496,  0.057233,  0.001000, 55.68,  0.999999, -0.05, -0.05, 0, 0, 
862, he wore no coat but carried one slung over his shoulder, he wore no coat a carried when lem over his shoulder, -0.00,  0.15, 610, 10.599159,  0.057133,  0.000956, 55.69,  0.999999,  0.00,  0.00, 0, 0, 
863, His shirt sleeves were rolled up too, his serts leaps were little up to,  0.00,  0.14, 610,  6.214424,  0.042111,  0.001033, 55.68,  0.999999,  0.01,  0.01, 0, 0, 
864, and his brown arms were bare to the elbows, and his brown arms were there to the elbows,  0.00,  0.14, 130, 37.032747,  0.226615,  0.004544, 42.26,  0.999970, -0.15, -0.15, 0, 0, 
865, Neither did he wear anything more on his head than his own crisply curling short dark hair, neither did he wear anything more in his head than his own crisply curling short dark hair,  0.00,  0.15, 610, 16.017183,  0.070923,  0.001066, 55.72,  0.999999, -0.03, -0.03, 0, 0, 
866, He was a dark man altogether with good eyes and a good bold breadth between them, he was a dark man altogether with good eyes and a good boat bread between them,  0.00,  0.15, 610, 13.635894,  0.063890,  0.001154, 55.69,  0.999999, -0.05, -0.05, 0, 0, 
867, Good humoured looking on the whole but implacable looking too, good humour looking on the whole but implacable looking too, -0.00,  0.15, 610,  9.766747,  0.054310,  0.001060, 55.68,  0.999999, -0.02, -0.02, 0, 0, 
868, evidently a man of a strong resolution and a set purpose, even a man of a strong resolution in the set purpose,  0.00,  0.14, 610, 10.330649,  0.055455,  0.001026, 55.69,  0.999999, -0.02, -0.02, 0, 0, 
869, a man not desirable to be met rushing down a narrow pass with a gulf on either side for nothing would turn the man, a man not desirable to be met rushing down the narrow pass with the bell on either side for nothing we turned the man,  0.00,  0.15, 610, 19.908896,  0.079083,  0.001114, 55.71,  0.999999, -0.04, -0.04, 0, 0, 
870, Madame Defarge his wife sat in the shop behind the counter as he came in, madame defarge his wife sat in the shelf behind the counter as he came in,  0.00,  0.14, 50, 149.435916,  0.724078,  0.013731, 33.98,  0.999800, -0.05, -0.05, 0, 0, 
871, Madame Defarge was a stout woman of about his own age with a watchful eye that seldom seemed to look at anything, madame defarge was a stounfulaminoftaboutisonatewithawatchfilithat seldom seemed to look at anything, -0.00,  0.15, 610, 18.614926,  0.075138,  0.001091, 55.68,  0.999999,  0.06,  0.06, 0, 0, 
872, a large hand heavily ringed a steady face strong features and great composure of manner, a large hand heavily ringed a steady face strong features and brave fromposure of manner, -0.00,  0.15, 150, 60.760834,  0.272559,  0.004158, 43.50,  0.999978, -0.04, -0.04, 0, 0, 
873, There was a character about Madame Defarge from which one might have predicated, there was a carried through that madame defarge from which we might have predicated,  0.00,  0.14, 610, 13.598625,  0.063154,  0.001144, 55.72,  0.999999,  0.03,  0.03, 0, 0, 
874, that she did not often make mistakes against herself in any of the reckonings over which she presided, that he the not often make mistakes against herself in any of the reckonings over which she presided, -0.00,  0.14, 610, 16.199084,  0.068711,  0.001009, 55.68,  0.999999,  0.00,  0.00, 0, 0, 
875, Madame Defarge being sensitive to cold was wrapped in fur, madame defarge being sensitive to cold was rat in for,  0.00,  0.14, 610,  9.772665,  0.052347,  0.000930, 55.74,  0.999999,  0.01,  0.01, 0, 0, 
876, and had a quantity of bright shawl twined about her head, and had at once i e of bright salt wind about her head,  0.00,  0.14, 610,  9.970913,  0.053928,  0.001007, 55.71,  0.999999,  0.09,  0.09, 0, 0, 
877, though not to the concealment of her large earrings, the lot of the concealment of her large earrings, -0.00,  0.15, 30, 177.231469,  1.043204,  0.021589, 29.56,  0.999447, -0.02, -0.02, 0, 0, 
878, Her knitting was before her but she had laid it down to pick her teeth with a toothpick, her anything was before her but she had laid it down to pick her teeth with a tooth pick, -0.00,  0.13, 610, 12.679916,  0.059091,  0.001038, 55.75,  0.999999, -0.00, -0.00, 0, 0, 
879, Thus engaged with her right elbow supported by her left hand, thus engaged with her red elbows supported by her left hand, -0.00,  0.13, 610,  9.525877,  0.050864,  0.000947, 55.75,  0.999999,  0.03,  0.03, 0, 0, 
880, Madame Defarge said nothing when her lord came in but coughed just one grain of cough, madame defarge said nothing when her lord came in but cough just when brain of cot, -0.00,  0.15, 610, 15.052017,  0.067631,  0.001009, 55.70,  0.999999, -0.03, -0.03, 0, 0, 
881, This in combination with the lifting of her darkly defined eyebrows over her toothpick by the breadth of a line, this in combination with the lifting of her darkly defying i grows over her tooth be by the breadth of the line,  0.00,  0.14, 610, 17.018515,  0.070303,  0.000998, 55.73,  0.999999, -0.02, -0.02, 0, 0, 
882, suggested to her husband that he would do well to look round the shop among the customers, said jested to her husband that he would do well to it round the shop and on the customers,  0.00,  0.13, 610, 12.995335,  0.059844,  0.000962, 55.69,  0.999999,  0.01,  0.01, 0, 0, 
883, for any new customer who had dropped in while he stepped over the way, for any new customer who had dropped in while his step over the way, -0.00,  0.15, 610, 11.608484,  0.059853,  0.001114, 55.69,  0.999999, -0.04, -0.04, 0, 0, 
884, The wine shop keeper accordingly rolled his eyes about, the wine softkeapercordinglyroledhis eyes about,  0.00,  0.15, 110, 55.874438,  0.308319,  0.006140, 40.83,  0.999959, -0.01, -0.01, 0, 0, 
885, until they rested upon an elderly gentleman and a young lady, and then they rested upon the elderly gentleman and the young lady,  0.00,  0.16, 610, 11.410731,  0.061180,  0.001128, 55.73,  0.999999,  0.02,  0.02, 0, 0, 
886, who were seated in a corner, we were seated in a corner, -0.00,  0.15, 610,  5.208040,  0.039849,  0.001053, 55.71,  0.999999, -0.12, -0.12, 0, 0, 
887, Other company were there two playing cards two playing dominoes three standing by the counter lengthening out a short supply of wine, other company were there to playing parts to playing dominoes three standing by the pound or lengthening out a short supply of wine, -0.00,  0.15, 610, 22.274844,  0.082901,  0.001091, 55.70,  0.999999,  0.02,  0.02, 0, 0, 
888, As he passed behind the counter he took notice that the elderly gentleman said in a look to the young lady, as he passed behind the counter he took notice that the elderly gentleman said in o it to the young lady,  0.00,  0.14, 610, 18.094250,  0.073532,  0.001035, 55.67,  0.999999,  0.01,  0.01, 0, 0, 
889, This is our man What the devil do you do in that galley there said Monsieur Defarge to himself, this is our man what the devil do you do in the galley there said miss er defarge to himself,  0.00,  0.15, 610, 15.217709,  0.067949,  0.001123, 55.69,  0.999999,  0.02,  0.02, 0, 0, 
890, I don't know you But he feigned not to notice the two strangers, i don't know you but i ain't not to notice the two strangers, -0.00,  0.15, 610, 10.742547,  0.056719,  0.001112, 55.73,  0.999999,  0.02,  0.02, 0, 0, 
891, and fell into discourse with the triumvirate of customers who were drinking at the counter, and fell into this course with the triune the customers who were drinking at the counter,  0.00,  0.14, 610, 13.882950,  0.062688,  0.000990, 55.77,  0.999999, -0.02, -0.02, 0, 0, 
892, How goes it Jacques said one of these three to Monsieur Defarge, and those i o sad in of these three to miss er defarge, -0.00,  0.14, 610,  9.304851,  0.050980,  0.000994, 55.66,  0.999999, -0.01, -0.01, 0, 0, 
893, Is all the spilt wine swallowed Every drop Jacques answered Monsieur Defarge, is all the spilt wine swallowed every drop shock answered miss er defarge,  0.00,  0.15, 610, 13.344604,  0.063391,  0.001160, 55.73,  0.999999,  0.01,  0.01, 0, 0, 
894, When this interchange of Christian name was effected, when this entertain of christian name was effected,  0.00,  0.14, 610,  8.298008,  0.048763,  0.000982, 55.69,  0.999999, -0.03, -0.03, 0, 0, 
895, Madame Defarge picking her teeth with her toothpick, madame defarge liking her teeth with her to stick,  0.00,  0.13, 610,  8.014832,  0.046136,  0.000875, 55.71,  0.999999, -0.04, -0.04, 0, 0, 
896, coughed another grain of cough and raised her eyebrows by the breadth of another line, cast another grain of cough and raised her lie brows by the breadth of another line, -0.00,  0.14, 610, 12.961991,  0.060953,  0.001038, 55.71,  0.999999, -0.02, -0.02, 0, 0, 
897, It is not often said the second of the three addressing Monsieur Defarge, it is not often said the second of the three addressing mister defarge,  0.00,  0.14, 610, 11.335038,  0.056994,  0.000986, 55.68,  0.999999,  0.02,  0.02, 0, 0, 
898, that many of these miserable beasts know the taste of wine, that many of these mislivlgeasts now to taste the fling,  0.00,  0.14, 30, 201.913697,  1.094365,  0.023225, 29.50,  0.999439,  0.01,  0.01, 0, 0, 
899, or of anything but black bread and death, or anything but left bretinxire, -0.00,  0.15, 610,  7.060890,  0.046350,  0.001075, 55.68,  0.999999, -0.01, -0.01, 0, 0, 
900, At this second interchange of the Christian name, this second interchange of the christian name,  0.00,  0.13, 70, 63.429389,  0.386919,  0.007946, 36.89,  0.999898,  0.00,  0.00, 0, 0, 
